objectid,filename,youtubeid, ,title,creator,circa,date,location,description,material,pattern ,design,format,rights ,longitude,lattitude,subject 
coll001,,wBKSMfroV-E,,Back Stitch Tutorial,"Buechel, Abby",,2026-04-09,"Iowa City, Iowa ",Tutorial on how to do a back stitch for embroidery.,Canvas and thread,Back Stitch,N/A,video/mp4,Colletion Creator,41.6578°,-91.5346°,stichting; needle; thread
coll002,,oEMqMXGdXBQ,,Chain Stitch Tutorial,"Buechel, Abby",,2026-04-09,"Iowa City, Iowa",Tutorial on how to do a chain stitch for embroidery. ,Canvas and thread,Chain Stitch,N/A,video/mp4,Colletion Creator,41.6578°,-91.5346°,stichting; needle; thread
coll003,,UpJ96OfdzJU,,Fishbone Stitch Tutorial,"Buechel, Abby",,2026-04-09,"Iowa City, Iowa",Tutorial on how to do a fishbone stitch for embroidery.,Canvas and thread,Fishbone Stitch,N/A,video/mp4,Colletion Creator,41.6578°,-91.5346°,stichting; needle; thread
coll004,,ium_SuQpVW8,,French Knot Stitch Tutorial,"Buechel, Abby",,2026-04-09,"Iowa City, Iowa",Tutorial on how to do a french knot stitch for embroidery.,Canvas and thread,French Knot Stitch,N/A,video/mp4,Colletion Creator,41.6578°,-91.5346°,stichting; needle; thread
coll005,,OVmJpPcrVmo,,Lazy Daisy Stitch Tutorial,"Buechel, Abby",,2026-04-09,"Iowa City, Iowa",Tutorial on how to do a lazy daisy stitch for embroidery.,Canvas and thread,Lazy Daisy Stitch,N/A,video/mp4,Colletion Creator,41.6578°,-91.5346°,stichting; needle; thread
coll006,,_a4IRlxTp5Y,,Running Stitch Tutorial,"Buechel, Abby",,2026-04-09,"Iowa City, Iowa",Tutorial on how to do a running stitch for embroidery.,Canvas and thread,Running Stitch,N/A,video/mp4,Colletion Creator,41.6578°,-91.5346°,stichting; needle; thread
coll007,,86fqP9o6pjI,,Woven Rose Stitch Tutorial ,"Buechel, Abby",,2026-04-09,"Iowa City, Iowa",Tutorial on how to do a woven rose stitch for embroidery.,Canvas and thread,Woven Rose Stitch,N/A,video/mp4,Colletion Creator,41.6578°,-91.5346°,stichting; needle; thread
coll008,,uMMS-vkJQ-g,,Satin Stitch Tutorial,"Buechel, Abby",,2026-04-09,"Iowa City, Iowa",Tutorial on how to do a satin stitch for embroidery.,Canvas and thread,Satin Stitch,N/A,video/mp4,Colletion Creator,41.6578°,-91.5346°,stichting; needle; thread
coll009,coll009.PNG,,,Bindalli Wedding Dress,,Mid 19th- early 20th Century ,,Turkey,"A dress worn for weddings and other events by Muslim and Jewish women in the Turkish region. The name Bindalli means thousands of branches, which are depicted in the embroidery. Dresses like this one were mostly owned and worn by wealthy women due to the extensive embroidery in gold fabric, but this type of dress was common among many economic classes of women. ",Cotton and metal wrapped thread,N/A,"Blossoms, Chains, Branches, Floral, and Tassels ",Image/PNG,Public Domain,41.6578°,-91.5346°,dress; fashion; traditional; wedding
coll010,coll010.PNG,,,Embroidary ,,18th Century,,Spain,"Silk embroidery with floral designs, potentially from the 18th century. Could potentially be Spanish and of the Spanish culture, but the exact location is unknown. Dimensions of the item are L.17 x W. 15 inches (43.2 x 38.1 cm).",Silk and metal thread,N/A,Florals,Image/PNG,Public Domain,41.6578°,-91.5346°,silk; floral; thread
coll011,coll011.PNG,,,Embroidary Sample From a Man's Suit,,1800-1815,,France,Sample from a man's suit. Floral design found in the French culture of the 1800's. ,Silk embroidary on silk velvet,N/A,Florals,Image/PNG,Public Domain,41.6578°,-91.5346°,fashion; french; clothing
coll012,coll012.PNG,,,Embroidary Textile With Dragon and Lotuses,,7th-8th Cenutury,,China,A piece of cloth depicting dragons and lotus flowers. From the Tang Dynasty in the 7th and 8th centuries. ,Silk with embroidary ,N/A,"Floral, Lotuses, and Dragons",Image/PNG,Public Domain,41.6578°,-91.5346°,silk; textile; florals; dragons
coll013,coll013.PNG,,,Embroidary With the Annunciation,,Mid15th Century,,Netherlands,"This piece was originally made as part of an ophrey (or an altar frontal). Has a Netherlandish technique in this work, using gold to provide glitter and a 3-dimensional quality. The image is depicting the Virgin Mary is kneeling before her prayer book with the archangel Gabriel at her side, telling her of the coming birth of Jesus. ",Silk and metallic threads on linen,N/A,Religious scene between The Virgin Mary and Archangel Gabriel,Image/PNG,Public Domain,41.6578°,-91.5346°,religion; art; scenery
coll014,coll014.PNG,,,Portrait of Charles II in Raised Work Embroidery,,,1675,England,Image of Charles II dressed in raised embroidery work and metal. The portrait is framed and considered textiles—embroidery—due to its 3D qualities. A recreation of the portrait originally done by John the Baptist Gaspers.,"Silk, lace, metal foil on silk",N/A,"Picture of Charles II, big hair seems to be the embroidery portion",Image/PNG,Public Domain,41.6578°,-91.5346°,art; royalty; adaptation
coll015,coll015.PNG,,,Sampler,"Jackson, Angentte ",,1828,"Boston, Massachusetts"," Agnette Jackson, daughter of prominent Black Abolitionists. She attended school at The Garrison Juvenile Society, where she learned to read, write, and do basic sewing. She recited,  “On religion”, which is embroidered onto this piece when the school recently gained funds for needlework. ",Silk embroidered on Linen,N/A,"Floral, wording, and a building",Image/PNG,Public Domain,41.6578°,-91.5346°,cloth; story; florals